<?xml version="1.0" encoding="utf-8"?>
<SpeciesConfig xmlns="pokemon.jbrown.com"
               xmlns:xsi="http://www.w3.org/2001/XMLSchema-instance"
               xsi:schemaLocation="pokemon.jbrown.com SpeciesConfigSchema.xsd">
    <Species>
        <Id>1</Id>
        <Name>Bulbasaur</Name>
        <Type1>Grass</Type1>
        <Type2/>
        <PokedexEntry>Lorem ipsum dolor sit amet...</PokedexEntry>
        <BaseStats>
            <HP>45</HP>
            <Attack>49</Attack>
            <Defense>49</Defense>
            <SpecialAttack>65</SpecialAttack>
            <SpecialDefense>65</SpecialDefense>
            <Speed>45</Speed>
        </BaseStats>
        <LearnSet>
            <LevelUpMoves>
                <MoveName>Tackle</MoveName>
            </LevelUpMoves>
            <TmHmMoves>
                <MoveName>SolarBeam</MoveName>
            </TmHmMoves>
            <EggMoves>
                <MoveName>Petal Dance</MoveName>
            </EggMoves>
        </LearnSet>
    </Species>
    <Species>
        <Id>2</Id>
        <Name>Ivysaur</Name>
        <Type1>Grass</Type1>
        <Type2>Poison</Type2>
        <PokedexEntry>Lorem ipsum dolor sit amet...</PokedexEntry>
        <BaseStats>
            <HP>45</HP>
            <Attack>49</Attack>
            <Defense>49</Defense>
            <SpecialAttack>65</SpecialAttack>
            <SpecialDefense>65</SpecialDefense>
            <Speed>45</Speed>
        </BaseStats>
        <LearnSet>
            <LevelUpMoves>
                <MoveName>Tackle</MoveName>
            </LevelUpMoves>
            <TmHmMoves>
                <MoveName>SolarBeam</MoveName>
            </TmHmMoves>
            <EggMoves>
                <MoveName>Petal Dance</MoveName>
            </EggMoves>
        </LearnSet>
    </Species>
    <GenerationDate>2016-12-28</GenerationDate>
</SpeciesConfig>